<?xml version="1.0" encoding="UTF-8"?>
<top-level xmlns:xsi="http://www.w3.org/2001/XMLSchema-instance"
  xsi:schemaLocation="http://csrc.nist.gov/ns/metaschema/testing/assembly schema.xsd"
  xmlns="http://csrc.nist.gov/ns/metaschema/testing/assembly" id="test">
  <child id="child1">
    <grandchild id="singleton-ungrouped">
      <field id="field1">value1</field>
    </grandchild>
    <grandchildren2>
      <grandchild id="multiple-grouped-1">
        <field id="field2a">value2a</field>
      </grandchild>
      <grandchild id="multiple-grouped-2">
        <field id="field2b">value2b</field>
      </grandchild>
    </grandchildren2>
    <grandchild id="single-1">
      <field id="field3">value3</field>
    </grandchild>
  </child>
  <child id="child2">
    <grandchild id="multiple-ungrouped-1">
      <!-- comment -->
      <field id="field4">value4</field>
    </grandchild>
    <grandchild id="multiple-ungrouped-2">
      <field id="field5">value5</field>
    </grandchild>
    <grandchildren2>
      <grandchild id="multiple-grouped-3">
        <field id="field6">value6</field>
      </grandchild>
      <grandchild id="multiple-grouped-4">
        <field id="field7">value7</field>
      </grandchild>
    </grandchildren2>
    <grandchild id="single-2">
      <field id="field8">value8</field>
    </grandchild>
  </child>
</top-level>
